{
  "schema_version": 1,
  "vocabulary_version": "1",
  "deprecations": [],
  "capabilities": [
    {
      "id": "needs-ui",
      "subcapabilities": ["interaction-design", "visual-quality", "responsive-experience", "browser-verification"],
      "roles": ["senior product designer", "frontend engineer", "accessibility reviewer"],
      "required_skills": ["ui-ux-design-quality", "qa-and-browser-verification"],
      "optional_skills": ["media-and-asset-pipeline", "throwaway-prototyping"],
      "required_audits": ["50_audits/CANONICAL_AUDIT_PROTOCOLS.md"],
      "required_templates": [],
      "required_release_gates": ["10_governance/RELEASE_GATES.md"]
    },
    {
      "id": "needs-api",
      "subcapabilities": ["api-contract", "external-api", "webhook-integration"],
      "roles": ["backend engineer", "integration engineer"],
      "required_skills": ["external-api-integration", "external-integration-launch-gate"],
      "optional_skills": ["codebase-design-and-deep-modules"],
      "required_audits": [],
      "required_templates": [],
      "required_release_gates": ["10_governance/RELEASE_GATES.md"]
    },
    {
      "id": "needs-storage",
      "subcapabilities": ["data-model", "data-integrity", "migration-safety"],
      "roles": ["data architect", "backend engineer"],
      "required_skills": ["domain-modeling-and-shared-language", "codebase-design-and-deep-modules"],
      "optional_skills": ["data-output-and-reporting"],
      "required_audits": [],
      "required_templates": [],
      "required_release_gates": ["10_governance/RELEASE_GATES.md"]
    },
    {
      "id": "needs-auth",
      "subcapabilities": ["identity-security", "authorization-security", "session-security"],
      "roles": ["security architect", "backend engineer"],
      "required_skills": ["web-application-security", "cybersecurity-risk-routing"],
      "optional_skills": ["security-incident-response"],
      "required_audits": ["50_audits/CANONICAL_AUDIT_PROTOCOLS.md"],
      "required_templates": [],
      "required_release_gates": ["10_governance/RELEASE_GATES.md"]
    },
    {
      "id": "needs-security",
      "subcapabilities": ["application-security", "supply-chain-security", "secrets-management", "abuse-resistance", "data-security", "incident-security", "ai-security", "risk-routing"],
      "roles": ["security architect", "application security engineer", "incident responder"],
      "required_skills": ["web-application-security", "supply-chain-and-build-provenance", "cybersecurity-risk-routing"],
      "optional_skills": ["ai-application-security", "security-incident-response"],
      "required_audits": ["50_audits/AUDIT_TIER_ROUTER.md", "50_audits/CANONICAL_AUDIT_PROTOCOLS.md"],
      "required_templates": [],
      "required_release_gates": ["10_governance/RELEASE_GATES.md"]
    },
    {
      "id": "needs-privacy",
      "subcapabilities": ["data-minimization", "retention", "consent", "sensitive-evidence"],
      "roles": ["privacy engineer", "security reviewer"],
      "required_skills": ["cybersecurity-risk-routing"],
      "optional_skills": ["security-incident-response"],
      "required_audits": [],
      "required_templates": [],
      "required_release_gates": ["10_governance/RELEASE_GATES.md"]
    },
    {
      "id": "needs-compliance",
      "subcapabilities": ["control-evidence", "governance-readiness", "auditability"],
      "roles": ["governance reviewer", "security reviewer"],
      "required_skills": ["mcp-tool-governance", "release-readiness-and-ship-gates"],
      "optional_skills": ["data-output-and-reporting"],
      "required_audits": ["50_audits/AUDIT_TIER_ROUTER.md"],
      "required_templates": ["60_templates/RELEASE_CANDIDATE_REPORT_TEMPLATE.md"],
      "required_release_gates": ["10_governance/RELEASE_GATES.md"]
    },
    {
      "id": "needs-performance",
      "subcapabilities": ["runtime-performance", "cost-control", "feedback-loop"],
      "roles": ["performance engineer", "senior debugger"],
      "required_skills": ["diagnosing-bugs-and-feedback-loops"],
      "optional_skills": ["agent-observability-and-run-tracing"],
      "required_audits": [],
      "required_templates": [],
      "required_release_gates": ["10_governance/RELEASE_GATES.md"]
    },
    {
      "id": "needs-ai",
      "subcapabilities": ["agent-control", "tool-governance", "prompt-security", "long-horizon-runtime"],
      "roles": ["AI systems architect", "agent reliability engineer"],
      "required_skills": ["ai-application-security", "mcp-tool-governance", "long-horizon-agent-runtime"],
      "optional_skills": ["repeatable-agent-loops", "agent-observability-and-run-tracing"],
      "required_audits": [],
      "required_templates": [],
      "required_release_gates": ["10_governance/RELEASE_GATES.md"]
    },
    {
      "id": "needs-infrastructure",
      "subcapabilities": ["hosting", "deployment", "build-provenance", "environment-setup"],
      "roles": ["platform engineer", "release engineer"],
      "required_skills": ["deployment-and-hosting-guidance", "project-bootstrap-and-setup", "supply-chain-and-build-provenance"],
      "optional_skills": ["using-git-worktrees"],
      "required_audits": [],
      "required_templates": [],
      "required_release_gates": ["10_governance/RELEASE_GATES.md"]
    },
    {
      "id": "needs-migration",
      "subcapabilities": ["branch-lifecycle", "schema-migration", "compatibility"],
      "roles": ["migration engineer", "release engineer"],
      "required_skills": ["finishing-a-development-branch", "using-git-worktrees"],
      "optional_skills": ["knowledge-refresh-and-drift-control"],
      "required_audits": [],
      "required_templates": [],
      "required_release_gates": ["10_governance/RELEASE_GATES.md"]
    },
    {
      "id": "needs-analytics",
      "subcapabilities": ["reporting", "measurement", "business-outcomes"],
      "roles": ["analytics engineer", "product strategist"],
      "required_skills": ["data-output-and-reporting", "product-strategy-office-hours"],
      "optional_skills": ["strategist-writing-dna"],
      "required_audits": [],
      "required_templates": [],
      "required_release_gates": ["10_governance/RELEASE_GATES.md"]
    },
    {
      "id": "needs-observability",
      "subcapabilities": ["run-tracing", "logs", "health-signals", "debug-evidence"],
      "roles": ["site reliability engineer", "observability engineer"],
      "required_skills": ["agent-observability-and-run-tracing", "diagnosing-bugs-and-feedback-loops"],
      "optional_skills": ["repeatable-agent-loops"],
      "required_audits": [],
      "required_templates": [],
      "required_release_gates": ["10_governance/RELEASE_GATES.md"]
    },
    {
      "id": "needs-documentation",
      "subcapabilities": ["developer-documentation", "user-guidance", "writing-quality", "decision-records"],
      "roles": ["technical writer", "developer experience engineer"],
      "required_skills": ["devex-and-documentation-review", "anti-ai-writing-quality"],
      "optional_skills": ["strategist-writing-dna", "compound-learning-capture"],
      "required_audits": [],
      "required_templates": [],
      "required_release_gates": []
    },
    {
      "id": "needs-accessibility",
      "subcapabilities": ["primary-task-accessibility", "keyboard-flow", "semantic-interface"],
      "roles": ["accessibility reviewer", "frontend engineer"],
      "required_skills": ["ui-ux-design-quality", "qa-and-browser-verification"],
      "optional_skills": [],
      "required_audits": [],
      "required_templates": [],
      "required_release_gates": ["10_governance/RELEASE_GATES.md"]
    },
    {
      "id": "needs-integration",
      "subcapabilities": ["third-party-service", "tool-mapping", "launch-gate"],
      "roles": ["integration engineer", "tooling engineer"],
      "required_skills": ["external-api-integration", "external-integration-launch-gate", "mcp-tool-governance"],
      "optional_skills": [],
      "required_audits": [],
      "required_templates": [],
      "required_release_gates": ["10_governance/RELEASE_GATES.md"]
    },
    {
      "id": "needs-media",
      "subcapabilities": ["asset-pipeline", "media-generation", "content-quality"],
      "roles": ["media engineer", "creative technologist"],
      "required_skills": ["media-and-asset-pipeline"],
      "optional_skills": ["anti-ai-writing-quality", "strategist-writing-dna"],
      "required_audits": [],
      "required_templates": [],
      "required_release_gates": []
    },
    {
      "id": "needs-scheduling",
      "subcapabilities": ["scheduled-work", "automation-routing", "bounded-retries"],
      "roles": ["automation engineer", "operations engineer"],
      "required_skills": ["scheduling-and-automation-routing", "repeatable-agent-loops"],
      "optional_skills": ["long-horizon-agent-runtime"],
      "required_audits": [],
      "required_templates": [],
      "required_release_gates": ["10_governance/RELEASE_GATES.md"]
    },
    {
      "id": "needs-release",
      "subcapabilities": ["planning", "implementation-control", "independent-review", "release-readiness"],
      "roles": ["staff engineer", "release manager", "independent reviewer"],
      "required_skills": ["writing-plans", "executing-plans", "engineering-plan-review", "code-review-and-review-army", "release-readiness-and-ship-gates"],
      "optional_skills": ["dispatching-parallel-agents", "subagent-driven-development", "20-pass-protocol"],
      "required_audits": ["50_audits/AUDIT_TIER_ROUTER.md"],
      "required_templates": ["60_templates/RELEASE_CANDIDATE_REPORT_TEMPLATE.md", "60_templates/STABLE_RELEASE_REPORT_TEMPLATE.md"],
      "required_release_gates": ["10_governance/RELEASE_GATES.md"]
    },
    {
      "id": "needs-incident-readiness",
      "subcapabilities": ["incident-response", "rollback", "recovery", "post-incident-learning"],
      "roles": ["incident commander", "site reliability engineer"],